NOME,ENDERECO,CONTATO,SITE_LISTA,SITE_MODAL
Móveis Naomi,"Próx ao metrô Tucuruvi - Av. Guapira, 789 - Tucuruvi, São Paulo - SP, 02265-001 ",(11) 98187-4477 ,N/A (Ignorado por segurança),http://moveisnaomi.com.br/
Seu achado moveis usados,"R. Edgar Sales, 164 - Jardim Peri, São Paulo - SP, 02633-020 ",(11) 94795-4003 ,N/A (Ignorado por segurança),Não informado
Quirino Lar,"R. Índio Peri, 52 - Jardim Peri, São Paulo - SP, 02632-000 ",(11) 95419-6230 ,N/A (Ignorado por segurança),https://chat.whatsapp.com/GWFXmo68T0mG7Vnj8HHVwK
COMÉRCIO DE MÓVEIS NOVOS,"Done Deal Comércio Móveis - Av. Direitos Humanos, 738 - Mandaqui, São Paulo - SP, 02475-000 ",(11) 99104-1013 ,N/A (Ignorado por segurança),Não informado
LS Móveis usados,"R. Condessa Amália Matarazzo, 96a - Jardim Peri, São Paulo - SP, 02652-000 ",(11) 95717-4286 ,N/A (Ignorado por segurança),Não informado
Cássia Bazar,"R. Alto Paraguai, 140 - Jardim Brasil (Zona Norte), São Paulo - SP, 02238-240 ",(11) 99717-4335 ,N/A (Ignorado por segurança),Não informado
Móveis Barato,"R. Fernando Pessoa, 284 - Vila Dionisia, São Paulo - SP, 02670-000 ",(11) 98608-7579 ,N/A (Ignorado por segurança),Não informado
Vital Móveis Usados,"Av. Dep. Cantídio Sampaio, 3456 - Vila Souza, São Paulo - SP, 02856-024 ",(11) 96981-0120 ,N/A (Ignorado por segurança),Não informado
Portal Moveis Usados,"Av. Elísio Teixeira Leite, 4982 - Jardim Paulistano (Zona Norte), São Paulo - SP, 02810-000 ",(11) 3993-4125 ,N/A (Ignorado por segurança),Não informado
Clean Móveis & Eletromésticos Novos e Usados,"Avenida Cerejeiras, 2475 Jardim Japão - Zona Norte, São Paulo - SP, 02124-002 ",(11) 98085-9751 ,N/A (Ignorado por segurança),Não informado
3E móveis e colchões,"Av. Itaberaba, 5127 - Vila Nova Cachoeirinha, São Paulo - SP, 02739-000 ",(11) 99511-8535 ,N/A (Ignorado por segurança),Não informado
SANTANA DECOR - Loja de Sofas - Racks - Painel - Mesas de Jantar,"Av. Dep. Emílio Carlos, 2028 - Limão, São Paulo - SP, 02720-200 ",(11) 97174-0663 ,N/A (Ignorado por segurança),https://www.facebook.com/santanadecorestofados
Mauri Móveis para Escritório,"Av. Itaberaba, 4168 - Jardim Maracana, São Paulo - SP, 02739-000 ",(11) 3851-4360 ,N/A (Ignorado por segurança),http://www.classeaflex.com.br/
AM COLCHÕES,"Av. Jd. Japão, 679A - Jardim Brasil (Zona Norte), São Paulo - SP, 02221-000 ",(11) 95902-2894 ,N/A (Ignorado por segurança),https://amcolchoes.com.br/
A Toca do Tutu Raposa,"Av. das Cerejeiras, 1394 - Jardim Japao, São Paulo - SP, 02124-001 ",(88) 99616-2852 ,N/A (Ignorado por segurança),Não informado
Sabina Móveis - Venda de móveis novos desde 1958,"R. Maria Cândida, 902 - Vila Guilherme, São Paulo - SP, 02071-001 ",(11) 2909-0894 ,N/A (Ignorado por segurança),http://www.sabinamoveis.com.br/
Regina Moveis Novos e Usados,"Av. Gabriela Mistral, 97 - Loja 1 - Penha de França, São Paulo - SP, 03701-011 ",(11) 95347-3836 ,N/A (Ignorado por segurança),Não informado
Bazar Unibes.,"R. Voluntários da Pátria, 2286 - Santana, São Paulo - SP, 02010-820 ",(11) 2950-3005 ,N/A (Ignorado por segurança),http://www.unibes.org.br/
Cida Móveis,"Av. Elísio Teixeira Leite, 1407 - Brasilândia, São Paulo - SP, 02801-000 ",(11) 95893-9390 ,N/A (Ignorado por segurança),https://www.instagram.com/cidamoveis_oficial?igsh=MWgzaWdxM3E4OWNtOA==
Móveis Marino,"Av. Imirim, 3764 - Cachoeirinha, São Paulo - SP, 02464-600 ",(11) 3981-2996 ,N/A (Ignorado por segurança),https://www.moveismarino.com.br/
Vimes Veleiro,"R. Conselheiro Moreira de Barros, 1871 - Lauzane Paulista, São Paulo - SP, 02430-000 ",(11) 2239-4624 ,N/A (Ignorado por segurança),http://www.vimesveleiro.com.br/
Tec Consert,"R. Encruzilhada do Sul, 21 - Jardim Paulistano (Zona Norte), São Paulo - SP, 02816-010 ",(11) 98375-5060 ,N/A (Ignorado por segurança),Não informado
Magnus Comercial,"R. Conselheiro Moreira de Barros - Lauzane Paulista, São Paulo - SP, 02430-000 ",(11) 2495-0666 ,N/A (Ignorado por segurança),Não informado
Comercial Materiais para Construção Peral,"Av. Itaberaba, 4380 - Vila Hebe, São Paulo - SP, 02739-000 ",(11) 3851-5597 ,N/A (Ignorado por segurança),Não informado
Desapega Nacional,"Av. Francisco Machado da Silva, 191 - Jardim Peri, São Paulo - SP, 02678-000 ",(11) 97604-0473 ,N/A (Ignorado por segurança),Não informado
Artefacto Rústico,"Av. Leôncio de Magalhães, 925 - Jardim São Paulo, São Paulo - SP, 02042-010 ",(11) 99900-8064 ,N/A (Ignorado por segurança),Não informado
Center Móveis,"Av. Dr. Francisco Ranieri, 795 - Lauzane Paulista, São Paulo - SP, 02435-061 ",(11) 2231-5114 ,N/A (Ignorado por segurança),Não informado
MÓVEIS AGORA italinea,"Av. Imirim, 1834 - Imirim, São Paulo - SP, 02464-300 ",(11) 2538-1890 ,N/A (Ignorado por segurança),Não informado
Família Vende Tudo Moderno ao Antigo - Giovanni Gronchi,"Av. Giovanni Gronchi, 823 - Morumbi, São Paulo - SP, 05651-000 ",(11) 93205-2444 ,N/A (Ignorado por segurança),https://fvtmodernoaoantigo.com.br/
Celmar | Alphaville,"Alameda Araguaia, 122 - Alphaville Industrial, Barueri - SP, 06455-000 ",(11) 96725-5327 ,N/A (Ignorado por segurança),https://celmaralphaville.com.br/
Fanfula Usados,"R. Fanfula, 300 - Americanópolis, São Paulo - SP, 04429-030 ",(11) 98558-9183 ,N/A (Ignorado por segurança),Não informado
Cabelo Móveis;compra e vendas de móveis novos e semi novos,"Av. Rodrigues Vilares, 350 - Jardim Iporanga, São Paulo - SP, 04828-100 ",(11) 94665-7769 ,N/A (Ignorado por segurança),http://www.sba.gov/
BellaAjuda,"R. José da Rocha Mendes Filho, 151 - Vila Santo Estefano, São Paulo - SP, 04153-090 ",(11) 98990-9879 ,N/A (Ignorado por segurança),https://www.bellaajuda.com/
Loja de Móveis Pietá | Santo Amaro -SP,"Av. Washington Luís, 4523 - Santo Amaro, São Paulo - SP, 04627-001 ",(11) 2362-2264 ,N/A (Ignorado por segurança),http://moveispieta.com.br/
FVTSP Família Vende Tudo São Paulo,"R. Gen. Euclídes Figueiredo, 400 - Morumbi, São Paulo - SP, 05688-020 ",(11) 98809-0019 ,N/A (Ignorado por segurança),http://www.fvtsp.com.br/
Bossa Nossa Casa,"R. Gen. Almério de Moura, 780 - Vila Tramontano, São Paulo - SP, 05690-080 ",(11) 93010-1969 ,N/A (Ignorado por segurança),https://www.bossanossacasa.com.br/
BETO DOS MOVEIS LOJAO DO POVO COMPRA E VENDAS DE MOVEIS USADOS,"R. Primo Fazzini, 26 - Cidade Júlia, São Paulo - SP, 04424-090 ",(11) 94240-9977 ,N/A (Ignorado por segurança),Não informado
Exército de Salvação - Bazar Beneficente - Vila Santa Catarina,"Av. Santa Catarina, 1781 - Vila Mascote, São Paulo - SP, 04378-300 ",(11) 4003-2299 ,N/A (Ignorado por segurança),http://www.exercitodoacoes.org.br/
Ln Móveis Usados | Unidade 1,"Av. Padre Arlindo Vieira, 3697 - Jardim Vergueiro (Sacoma), São Paulo - SP, 04166-003 ",(11) 97159-1860 ,N/A (Ignorado por segurança),Não informado
Atacadão Móveis,"Av. São Miguel, 4981 - Jardim Cotinha, São Paulo - SP, 03871-100 ",(11) 94239-2483 ,N/A (Ignorado por segurança),Não informado
Brechó da Tito,"Rua: Tito oliani, 769 - Sacoma, São Paulo - SP, 04256-000 ",(11) 98997-8624 ,N/A (Ignorado por segurança),Não informado
Mvs Móveis Usados,"Travessa com a - Estrada do M'Boi Mirim, R. Nestor Pires, 9998 - lado par, São Paulo - SP, 04948-030 ",(11) 94286-2537 ,N/A (Ignorado por segurança),Não informado
Retiramos doações de móveis retiramos doações gratuitas em até 24 horas,"Rua da safra 757 Rua da safra 747 Instituto Adventista santo Amaro, São Paulo - SP, 05868-040 ",(11) 97392-7762 ,N/A (Ignorado por segurança),Não informado
Opina Móveis Usados,"Estr. do Campo Limpo, 2245 - Jardim Paris, São Paulo - SP, 05761-450 ",(11) 5842-5475 ,N/A (Ignorado por segurança),Não informado
"Bazar Beneficente LALEC - Lar, Amor, Luz e Esperança da Criança","Alameda Iraé, 47 - Indianópolis, São Paulo - SP, 04075-000 ",(11) 5052-8085 ,N/A (Ignorado por segurança),http://www.lalec.org/
Skybabau Moveis novos e usados .,"R. Odemis, 28 - Jardim Umuarama, São Paulo - SP, 05783-180 ",(11) 96686-2652 ,N/A (Ignorado por segurança),Não informado
Dado Móveis Usados,"R. Gen. Lucídio de Arruda, 497 - Jardim Santa Margarida, São Paulo - SP, 04930-030 ",(11) 96894-9181 ,N/A (Ignorado por segurança),Não informado
Gilson Móveis Usados,"R. Rio Branco, 26 - Jardim Marilda, São Paulo - SP, 04857-280 ",(11) 96568-3619 ,N/A (Ignorado por segurança),Não informado
Bira Colchões,"R. do Engenho, 131 - Vila Nova Cachoeirinha, São Paulo - SP, 02612-130 ",(11) 2628-9404 ,N/A (Ignorado por segurança),http://biracolchoes.com.br/
Galeria Batata Antiguidades,"R. Cantarricos, 10 - Imirim, São Paulo - SP, 02540-020 ",(11) 97144-8660 ,N/A (Ignorado por segurança),https://mechamenozap.com.br/galeriabatataantiguidades/
Outlet Novos e Usados,"Av. São Miguel, 6687 A - Vila Norma, São Paulo - SP, 08070-002 ",(11) 94943-2119 ,N/A (Ignorado por segurança),https://www.instagram.com/outletnovoseusados/
Loja de Móveis Usados - Saldanha Marinho - 111,"R. Saldanha Marinho, 111 - Belenzinho, São Paulo - SP, 03055-020 ",(11) 91116-1962 ,N/A (Ignorado por segurança),http://www.classeaflex.com.br/
Fonte das Pechinchas - Móveis e Colchões,"Av. Pires do Rio, 3440 - Jardim Norma, São Paulo - SP, 08240-005 ",(11) 2052-2627 ,N/A (Ignorado por segurança),https://www.instagram.com/fontepechinchas/
FRETES E CARRETOS MÓVEIS USADOS,"R. Harry Dannenberg, 1004 - Vila Carmosina, São Paulo - SP, 08270-010 ",(11) 91298-0064 ,N/A (Ignorado por segurança),Não informado
Bento novos e usados,"Av. Bento Guelfi - Jardim Iguatemi, São Paulo - SP, 08381-001 ",(11) 98139-6928 ,N/A (Ignorado por segurança),Não informado
MH Office - Móveis de Escritório,"Av. Rio das Pedras, 2045 - Jardim Aricanduva, São Paulo - SP, 03453-100 ",(11) 97426-5443 ,N/A (Ignorado por segurança),https://www.mhoffice.com.br/
KAngelus Móveis - Tucuruvi,"Av. Nova Cantareira, 1909 - Tucuruvi, São Paulo - SP, 02331-003 ",(11) 93496-8281 ,N/A (Ignorado por segurança),Não informado
Empório Eletros,"R. Flor de Inverno, 353 - Jardim das Camelias, São Paulo - SP, 08050-310 ",(11) 97825-8434 ,N/A (Ignorado por segurança),https://instagram.com/emporio_eletros2021?igshid=ZDdkNTZiNTM=
Mercatudo Casas André Luiz - Unidade São Miguel,"R. Mohamad Ibrahim Saleh, 602 - São Miguel Paulista, São Paulo - SP, 08042-130 ",(11) 2561-1769 ,N/A (Ignorado por segurança),http://www.mercatudo.org.br/
Casa de móveis novos e usado,"Rua Domingos Rosolia, 197 - Jardim São Jorge, São Paulo - SP, 05567-000 ",(11) 99381-3202 ,N/A (Ignorado por segurança),https://wa.me/qr/Y2NHMI3H5Q3GN1
S.O.S Móveis Antigos,"Rua Cardeal Arcoverde, 1301/1309 - Pinheiros, São Paulo - SP, 05407-001 ",(11) 3812-0169 ,N/A (Ignorado por segurança),http://www.sosmoveisantigos.com.br/
Loja de Móveis Vila Borges,"R. Gen. Teixeira de Campos, 15 - Jardim Cláudia, São Paulo - SP, 05546-000 ",(11) 96022-9528 ,N/A (Ignorado por segurança),Não informado
Célio Móveis Novos e Seminovos,"Av. Laurita Ortega Mari, 1946 - Parque Pinheiros, Taboão da Serra - SP, 06766-361 ",(11) 97333-3227 ,N/A (Ignorado por segurança),Não informado
E & P Moveis Usados,"Estrada Kizaemon Takeuti 233, Estr. Kizaemon Takeuti, 239 - Jardim Clementino, Taboão da Serra - SP, 06775-000 ",(11) 97135-1802 ,N/A (Ignorado por segurança),Não informado
ded móveis usados,"Estrada Kizaemon Takeuti, 233, Estr. Kizaemon Takeuti, 239 - Jardim Clementino, Taboão da Serra - SP, 06775-000 ",(11) 91913-4301 ,N/A (Ignorado por segurança),Não informado
Osvaldo Antiguidades - Loja de Móveis Clássicos e Vintage,"R. Dronsfield, 432 - Lapa, São Paulo - SP, 05074-000 ",(11) 3831-3899 ,N/A (Ignorado por segurança),http://www.osvaldoantiguidades.com.br/
Ponto Azul Móveis Outlet,"Av. Alexios Jafet, 526 - Jardim Ipanema (Zona Oeste), São Paulo - SP, 05187-010 ",(11) 96039-7961 ,N/A (Ignorado por segurança),Não informado
Móveis Usados Renovo,"R. Ana Cintra, 206 - Campos Elíseos, São Paulo - SP, 01201-060 ",(11) 98414-6752 ,N/A (Ignorado por segurança),Não informado
Móveis Ivana,"Av. São João, 1603 - Santa Cecilia, São Paulo - SP, 01211-100 ",(11) 94149-7893 ,N/A (Ignorado por segurança),Não informado
Loja da família móveis usados,"Av. Jerimanduba, 510 - Jaraguá, São Paulo - SP, 05181-000 ",(11) 99188-3307 ,N/A (Ignorado por segurança),Não informado
Feirão de Móveis Usados,"Estr. Kizaemon Takeuti, 187 - Jardim Clementino, Taboão da Serra - SP, 06775-000 ",(11) 98259-3075 ,N/A (Ignorado por segurança),Não informado
Paulo móveis,"Avenida vila Matias 34 Jardim Santa Rita, Praça Oito de Dezembro - Taboão, Guarulhos - SP, 07143-190 ",(11) 94484-6389 ,N/A (Ignorado por segurança),Não informado
MF cadeiras,"R. Belchior de Azevedo, 42 - Vila Leopoldina, São Paulo - SP, 05089-030 ",(11) 94785-2083 ,N/A (Ignorado por segurança),Não informado
montador de móveis vila galvão,"R. Treze de Maio - Vila Galvão, Guarulhos - SP, 07071-050 ",(11) 95930-5488 ,N/A (Ignorado por segurança),https://nepmontagens.com/oficial
Garagem de Usados Bellore,"R. Guarani, 620 - Vila Galvão, Guarulhos - SP, 07074-010 ",(11) 96313-8727 ,N/A (Ignorado por segurança),https://www.facebook.com/garagemdeusadosbellore/
Loja de usados do amigão 011,"R. João Genuíno Sobral, 242 - Parque Continental II, Guarulhos - SP, 07084-130 ",(11) 95743-3215 ,N/A (Ignorado por segurança),Não informado
KM Móveis | Loja de Móveis,"Av. Emílio Ribas, 2142 - Jardim Vila Galvao, Guarulhos - SP, 07050-001 ",(11) 2408-4000 ,N/A (Ignorado por segurança),Não informado
Comércio de Roupas e Móveis Usados,"R. Leoberto Leal, 5 - Vila Fiuza, Guarulhos - SP, 07097-090 ",(11) 3435-2580 ,N/A (Ignorado por segurança),Não informado
Constantino Pedro Sobral Móveis Usados,"R. Taguaí, 556 - Jardim São Paulo, Guarulhos - SP, 07131-040 ",(11) 3437-1972 ,N/A (Ignorado por segurança),Não informado
Gil Móveis Rústicos,"Av. Júlio Prestes, 1038 - Vila Galvão, Guarulhos - SP, 07063-010 ",(11) 98471-8769 ,N/A (Ignorado por segurança),Não informado
O Baratão,"R. Cachoeira, 130 - Picanço, Guarulhos - SP, 07080-000 ",(11) 2453-5453 ,N/A (Ignorado por segurança),Não informado
Usadão Paraíso,"Av. Silvestre Pires de Freitas, 1890 - Jardim Paraiso, Guarulhos - SP, 07144-000 ",(11) 2279-3365 ,N/A (Ignorado por segurança),Não informado
J&F Móveis Usados,"R. Direitos Humanos, 294 - Parque Continental II, Guarulhos - SP, 07084-040 ",(11) 98705-2738 ,N/A (Ignorado por segurança),https://sites.google.com/view/j-f-mveis?usp=sharing
Julio Móveis Usados,"R. Santo Antônio do Aventureiro, 83 - Jardim Kawamoto, Guarulhos - SP, 07143-040 ",(11) 95092-9973 ,N/A (Ignorado por segurança),Não informado
Tio Salú moveis usados,"R. Direitos Humanos, 27 - Parque Continental II, Guarulhos - SP, 07084-040 ",(11) 94510-7659 ,N/A (Ignorado por segurança),Não informado
Paulo móveis novos e usados,"R. Miguel Fernandes Maldonado, N: 16 - Jardim Santa Rita, Guarulhos - SP, 07143-190 ",(11) 94484-6389 ,N/A (Ignorado por segurança),Não informado
Lojão De Móveis Usados,"Estr. do Moinho Velho, 431 - Jardim Angelica, Guarulhos - SP, 07260-220 ",(11) 98805-9496 ,N/A (Ignorado por segurança),Não informado
Megabazar,"R. Nossa Sra. Mãe dos Homens, 1107 - Vila Progresso, Guarulhos - SP, 07091-000 ",(11) 2859-4335 ,N/A (Ignorado por segurança),Não informado
Montador de móveis Guarulhos,"Praça Oito de Dezembro - Jardim Capri, Guarulhos - SP, 07140-160 ",(11) 93250-3710 ,N/A (Ignorado por segurança),http://www.facebook.com/MontadordemoveisprofissionalOscar/
Tamakazuza,"Estr. Elenco, 1274 - Jardim Sao Domingos, Guarulhos - SP, 07142-000 ",(11) 2401-7450 ,N/A (Ignorado por segurança),Não informado
moveis em Guarulhos,"Av. Suplicy, 238 - 1 - Picanço, Guarulhos - SP, 07090-000 ",(11) 96879-6196 ,N/A (Ignorado por segurança),Não informado
Cido & Cida Loja de Móveis,"R. Raimundo Almeida de Araújo, 399 - Vila Florida, Guarulhos - SP, 07122-000 ",(11) 96157-4973 ,N/A (Ignorado por segurança),Não informado
Casa Bela Móveis,"R. Cerejeira - Parque Continental II, Guarulhos - SP, 07084-340 ",(11) 2457-4483 ,N/A (Ignorado por segurança),Não informado
Mercatudo Casas André Luiz - Unidade Vila Rio,"Praça Paulo Hideo Futami, 61 - Vila Rio de Janeiro, Guarulhos - SP, 07080-001 ",(11) 3995-7884 ,N/A (Ignorado por segurança),https://www.mercatudo.org.br/
Novittá Design Guarulhos – Loja de Móveis e Sofás,"Av. Dr. Timóteo Penteado, 578 - Centro, Guarulhos - SP, 07094-000 ",(11) 2447-1449 ,N/A (Ignorado por segurança),http://www.novittadesign.com.br/
Saldão Mercatudo David Marques,"Av. José Rangel Filho, 113 - Jardim Pte. Alta I, Guarulhos - SP, 07179-350 ",(11) 95923-8913 ,N/A (Ignorado por segurança),https://saldaomercatudo.com.br/
Brito Office,"R. Cabo Antônio Pereira da Silva, 187 - Jardim Tranquilidade, Guarulhos - SP, 07051-011 ",(11) 2421-6622 ,N/A (Ignorado por segurança),http://www.britooffice.com.br/
Mikail Móveis,"Estr. Elenco, 1494 - Jardim Sao Domingos, Guarulhos - SP, 07142-000 ",(11) 96673-1089 ,N/A (Ignorado por segurança),Não informado
Atacadão dos Colchões,"Av. Otávio Braga de Mesquita, 2456 - Vila Florida, Guarulhos - SP, 07191-000 ",(11) 91025-3333 ,N/A (Ignorado por segurança),Não informado
Vieira Móveis usados,"Av. Maria do Socorro e Silva Bezerra, 105 - Jardim Nova Cidade, Guarulhos - SP, 07252-300 ",(11) 95932-8872 ,N/A (Ignorado por segurança),Não informado
Marcão Móveis Para Escritório,"Picanço, Guarulhos - SP, 07097-380 ",(11) 2451-1188 ,N/A (Ignorado por segurança),Não informado
all farias.all novos e usados,"R. Natalina - Recreio São Jorge, Guarulhos - SP, 07144-230 ",(11) 97888-1039 ,N/A (Ignorado por segurança),https://chat.whatsapp.com/LTCySmsZ42DDJM3tl6sj1i
Móveis SOS - Móveis para escritório,"Av. Monteiro Lobato, 725 - Macedo, Guarulhos - SP, 07112-000 ",(11) 2441-3853 ,N/A (Ignorado por segurança),http://www.moveissos.com.br/
Móveis Neto,"R. Cachoeira, 1313 - Jardim Paulista, Guarulhos - SP, 07080-000 ",(11) 2457-4233 ,N/A (Ignorado por segurança),Não informado
Mikail Móveis,"R. Maria Ferreira Calsado, 31 - Parque Mikail, Guarulhos - SP, 07142-370 ",(11) 2088-5082 ,N/A (Ignorado por segurança),Não informado
Azevedo Móveis para Escritório,"Av. Dr. Timóteo Penteado, 1855 - Vila Hulda, Guarulhos - SP, 07094-000 ",(11) 2459-1057 ,N/A (Ignorado por segurança),http://www.azevedomoveis.com.br/
Remar Brasil,"R. Padre João Álvares, 548 - Vila Renata, Guarulhos - SP, 07056-000 ",(11) 94449-4443 ,N/A (Ignorado por segurança),http://www.remarbrasil.org.br/
ESPAÇO BELLORE ESTÉTICA E MASSAGEM,"R. Gentil de Castro Lessa, 16 - Jardim Santa Francisca, Guarulhos - SP, 07013-080 ",(11) 99214-3469 ,N/A (Ignorado por segurança),Não informado
Exército de Salvação - Guarulhos - SP,"Rua Nossa Senhora Aparecida, 105 - Vila Nossa Sra. de Fatima, Guarulhos - SP, 07191-190 ",(11) 2409-1500 ,N/A (Ignorado por segurança),Não informado
NEW MÓVEIS USADOS PARA ESCRITÓRIO,"Rua Jamil João Zarif, 416 - Jardim Santa Vicencia, Guarulhos - SP, 07143-000 ",(11) 5050-2936 ,N/A (Ignorado por segurança),Não informado
Cazatudo Guarulhos,"Estr. Pres. Juscelino K. de Oliveira, 3505 - Jardim Albertina, Guarulhos - SP, 07252-000 ",(11) 96641-1274 ,N/A (Ignorado por segurança),https://beacons.page/cazatudo.com_outlet
Mercatudo Casas André Luiz - Unidade Pimentas,"R. Joaquim Moreira, 39 - Pimentas, Guarulhos - SP, 07260-220 ",(11) 2499-1304 ,N/A (Ignorado por segurança),http://mercatudo.org.br/
MONTEIRO MOVEIS P/ ESCRITÓRIO & RESIDENCIA,"Av. Monteiro Lobato, 442 - Centro, Guarulhos - SP, 07112-000 ",(11) 2409-4029 ,N/A (Ignorado por segurança),http://www.monteiromoveis.com.br/
Eroflex Mobiliário Corporativo,"R. Cavadas, 43 - Vila Sao Joao, Guarulhos - SP, 07044-000 ",(11) 2425-4555 ,N/A (Ignorado por segurança),https://www.eroflex.com.br/
Ateliê do Luís - Tapeçaria de Móveis Estofados,"Alameda Aída, 94 - Gopouva, Guarulhos - SP, 07092-050 ",(11) 98493-3725 ,N/A (Ignorado por segurança),Não informado
Decor Industrial Móveis,"R. Sorocaba, 289 - Jardim Bela Vista, Guarulhos - SP, 07132-340 ",(11) 98770-3837 ,N/A (Ignorado por segurança),https://www.instagram.com/decor_industrialmoveis
O Bagação Móveis para Escritório,"Av. Novo Osasco, 574 - Bussocaba, Osasco - SP, 06056-000 ",(11) 3609-7155 ,N/A (Ignorado por segurança),http://obagacao.com.br/
Lojão de Móveis Santa Maria,"Av. Ayrton Senna, 143 - Santa Maria, Osasco - SP, 06149-201 ",(11) 97984-2150 ,N/A (Ignorado por segurança),Não informado
Samu Móveis Para Escritório,"Av. dos Autonomistas, 6162 - Km 18, Osasco - SP, 06194-060 ",(11) 98270-6185 ,N/A (Ignorado por segurança),http://samumoveis.com.br/
"Casa Ellegance - Móveis, Decor. e Planejados - Osasco","Av. dos Autonomistas, 3183 - Centro, Osasco - SP, 06090-015 ",(11) 3689-1421 ,N/A (Ignorado por segurança),https://loja.casaellegance.com.br/
Cruzeiro do Sul Móveis,"Av. Cruzeiro do Sul, 1092 - Rochdale, Osasco - SP, 06226-006 ",(11) 93951-3130 ,N/A (Ignorado por segurança),Não informado
Lumi Móveis,"Av. João Batista, 260 - Centro, Osasco - SP, 06097-090 ",(11) 4624-6123 ,N/A (Ignorado por segurança),http://www.lumimoveis.com/
Geraldo Donisete Compra E Venda De Usados,"Av. Pres. Médici, 1052 - Parque Industrial Mazzei, Osasco - SP, 06268-000 ",(11) 95914-0433 ,N/A (Ignorado por segurança),Não informado
Snake Móveis Montagens e Remanejamentos,"R. Benjamin Inácio de Souza - Bussocaba, Osasco - SP, 06056-220 ",(11) 94844-6796 ,N/A (Ignorado por segurança),Não informado
Dosul - Móveis de Madeira,"R. Pedro Fioretti, N:365 - Centro, Osasco - SP, 06013-080 ",(11) 3683-8908 ,N/A (Ignorado por segurança),Não informado
Casa Saldão,"Esquina com a - Rua Miguel de Cervantes, Estr. da Divisa, 231 - Santa Maria, Osasco - SP, 06149-208 ",(11) 93957-2115 ,N/A (Ignorado por segurança),http://www.casasaldao.com.br/
Eliana Móveis,"R. Vinte e Sete de Janeiro, 104 - Novo Osasco, Osasco - SP, 06045-000 ",(11) 3609-1057 ,N/A (Ignorado por segurança),Não informado
Móveis Rocha,"Av. Gen. Pedro Pinho, 1068 - Pestana, Osasco - SP, 06122-160 ",(11) 99713-5788 ,N/A (Ignorado por segurança),https://moveisrochaonline.lojavirtualnuvem.com.br/
Mob-Lux Móveis,"R. Pedro Fioretti, 128 - Centro, Osasco - SP, 06013-070 ",(11) 3699-6960 ,N/A (Ignorado por segurança),Não informado
Alegria móveis e antiguidades,"R. Orquídea, 860 - Jardim das Flores, Osasco - SP, 06112-070 ",(11) 98820-3032 ,N/A (Ignorado por segurança),Não informado
Adriático Móveis Usados,"R. Adriático, 1190 - Jardim do Estádio, Santo André - SP, 09172-180 ",(11) 99941-5875 ,N/A (Ignorado por segurança),Não informado
Dom Pedro I Móveis Usados,"Av. Dom Pedro I, 2187 - Vila Pires, Santo André - SP, 09130-410 ",(11) 99598-3600 ,N/A (Ignorado por segurança),Não informado
Moveis Usados para Escritório,"R. Nicolau Copérnico, 59 - Vila América, Santo André - SP, 09110-290 ",(11) 4474-0968 ,N/A (Ignorado por segurança),http://movesq.com.br/
Loja de Moveis usados CSO,"R. Carijós, 3823 A - Vila Linda, Santo André - SP, 09180-001 ",(11) 97447-1248 ,N/A (Ignorado por segurança),Não informado
Rm Móveis Usados,"Av. Queirós Filho, 3307 - Parque Industriario, Santo André - SP, 09121-587 ",(11) 94816-2219 ,N/A (Ignorado por segurança),https://www.facebook.com/rm.moveisusados?mibextid=2JQ9oc
Trato Feito ABC,"Praça Nova Iorque, 13 - Utinga, Santo André - SP, 09220-760 ",(11) 94741-9589 ,N/A (Ignorado por segurança),Não informado
Geraldo Móveis,"Alameda Sebastião do Amaral, 549 - Jardim Ipanema, Santo André - SP, 09130-110 ",(11) 98520-5438 ,N/A (Ignorado por segurança),Não informado
Loja de moveis usados Braga,"Av. das Nações - Parque Novo Oratório, Santo André - SP, 09270-400 ",(11) 95600-4064 ,N/A (Ignorado por segurança),Não informado
Loja De Móveis Usados,"R. Egito, 34 - Vila Curuçá, Santo André - SP, 09280-760 ",(11) 96451-9120 ,N/A (Ignorado por segurança),Não informado
Loja de Móveis Usados Pernambuco,"Av. João Pessoa, 01 - Vila Camilópolis, Santo André - SP, 09020-650 ",(11) 4461-4399 ,N/A (Ignorado por segurança),Não informado
3A Móveis Rústicos,"R. Catequese, 1621 - Vila Guiomar, Santo André - SP, 09090-401 ",(11) 2324-4234 ,N/A (Ignorado por segurança),https://www.3amoveisrusticos.com.br/
Casa Jordania Móveis e Decorações,"Av. Queirós Filho, 2428 - Vila Guaraciaba, Santo André - SP, 09121-587 ",(11) 4455-7642 ,N/A (Ignorado por segurança),Não informado
Toque Móveis | Loja de Móveis em Santo André | Loja de Móveis,"R Oratório, 1847 - Parque das Nações, Santo André - SP, 09280-000 ",(11) 2324-4259 ,N/A (Ignorado por segurança),https://is.gd/xdKQmV
Segunda Opção Móveis ABC,"Av. Nova Iorque, 311 - Utinga, Santo André - SP, 09220-780 ",(11) 95558-9185 ,N/A (Ignorado por segurança),Não informado
MadeiraMadeira - Loja de Móveis e Artigos para Casa,"R. Bernardino de Campos, 75 - Centro, Santo André - SP, 09015-010 ",(11) 91151-2373 ,N/A (Ignorado por segurança),https://www.madeiramadeira.com.br/?utm_source=google&utm_medium=organic&utm_campaign=maps_22
Demema Outlet,"Av. dos Estados, 33 - Parque Central, Santo André - SP, 09210-580 ",(11) 4462-3300 ,N/A (Ignorado por segurança),http://www.dememaoutlet.com.br/
Super Casa,"R. Campos Sales, 297 - Centro, Santo André - SP, 09010-020 ",(11) 4438-0064 ,N/A (Ignorado por segurança),Não informado
Armanny Móveis - Loja de Móveis Santo André,"R. Gen. Glicério, 375 - Centro, Santo André - SP, 09015-191 ",(11) 4436-2350 ,N/A (Ignorado por segurança),https://www.instagram.com/armannymoveis/
Móveis Paraíso,"R. Jabaquara, 218 - Paraíso, Santo André - SP, 09190-660 ",(11) 4438-8351 ,N/A (Ignorado por segurança),Não informado
Bio Móveis,"Estr. do Pedroso, 552 - Vila Luzita, Santo André - SP, 09132-180 ",(11) 4974-0090 ,N/A (Ignorado por segurança),Não informado
